{
  "$schema": "../../schemas/template-v1.json",
  "version": "0.0.1",
  "type": "application",
  "id": "ios-example-app",
  "displayName": "Example iOS App",
  "description": "A simple iOS app template demonstrating the magen-templates system (test-only)",
  "hidden": true,
  "platform": {
    "type": "ios",
    "minVersion": "15.0"
  },
  "useCase": {
    "primary": "Simple iOS app demonstrating template system",
    "scenarios": [
      "Learning how to create templates",
      "Testing template generation",
      "Example for template authors"
    ],
    "when": "Use this template as a reference example for creating your own templates"
  },
  "capabilities": [
    "native-ios",
    "swift",
    "swiftui",
    "example"
  ],
  "extensionPoints": [
    {
      "id": "add-view",
      "name": "Add New View",
      "description": "Add a new SwiftUI view to the app",
      "affectedFiles": [
        "template/{{projectName}}/ContentView.swift"
      ],
      "aiGuidance": "Create a new Swift file in the project Define a SwiftUI View struct Add @State properties as needed Update ContentView to include navigation"
    }
  ],
  "requirements": {
    "skillLevel": "beginner",
    "estimatedTime": "30 minutes"
  },
  "templateVariables": [
    {
      "name": "projectName",
      "type": "string",
      "description": "The name of the iOS project",
      "required": true,
      "example": "MyApp",
      "validation": "^[A-Za-z][A-Za-z0-9_]*$"
    },
    {
      "name": "organization",
      "type": "string",
      "description": "Organization name for Xcode project",
      "required": true,
      "example": "My Company"
    }
  ],
  "generation": {
    "fileTransforms": [
      {
        "pattern": "**/*.swift.hbs",
        "processor": "handlebars"
      }
    ]
  },
  "documentation": {
    "readme": "README.md"
  },
  "tags": [
    "ios",
    "swift",
    "swiftui",
    "example",
    "simple"
  ]
}