{
  "$schema": "../../schemas/template-v1.json",
  "version": "0.0.1",
  "type": "application",
  "id": "ios-mobilesync",
  "displayName": "iOS MobileSync",
  "description": "A comprehensive iOS Swift application template demonstrating advanced Salesforce Mobile SDK integration using MobileSync data framework. This template provides a full-featured contact management app with offline sync capabilities, search functionality, and a modern SwiftUI interface with split-view navigation.",
  "platform": {
    "type": "ios",
    "minVersion": "15.0"
  },
  "useCase": {
    "primary": "Production-ready iOS app with full Salesforce data synchronization",
    "scenarios": [
      "Offline-first mobile applications",
      "Complex data relationships and sync",
      "Professional-grade contact management",
      "Widget-enabled apps"
    ],
    "when": "Use this template when you need to create a production-ready iOS app with full Salesforce data synchronization capabilities."
  },
  "capabilities": [
    "native-ios",
    "swift",
    "swiftui",
    "salesforce-sdk",
    "mobilesync",
    "offline-sync",
    "smartstore",
    "contact-management",
    "search-functionality",
    "split-view-navigation",
    "notifications",
    "settings-management",
    "widget-support",
    "dark-mode-support"
  ],
  "extensionPoints": [
    {
      "id": "salesforce-objects",
      "name": "Salesforce Objects",
      "description": "Add new Salesforce objects beyond the default Contact",
      "affectedFiles": [
        "template/MobileSyncExplorerSwift/SObjects/Contacts.swift",
        "template/MobileSyncExplorerSwift/SObjects/SObjects.swift"
      ],
      "aiGuidance": "Create new SObject data classes following the ContactSObjectData pattern Implement required protocols and constants Add to SObjects.swift registry"
    },
    {
      "id": "ui-components",
      "name": "UI Components",
      "description": "Extend the SwiftUI interface with additional components",
      "affectedFiles": [
        "template/MobileSyncExplorerSwift/UI/ContactList/ContactList.swift",
        "template/MobileSyncExplorerSwift/UI/ContactDetail/ContactDetail.swift"
      ],
      "aiGuidance": "Add new SwiftUI views following existing patterns Implement navigation between views Customize split-view behavior"
    }
  ],
  "requirements": {
    "skillLevel": "intermediate",
    "estimatedTime": "45 minutes"
  },
  "templateVariables": [
    {
      "name": "projectName",
      "type": "string",
      "description": "The name of the iOS project",
      "required": true,
      "example": "MySyncApp",
      "validation": "^[A-Za-z][A-Za-z0-9_]*$"
    },
    {
      "name": "organization",
      "type": "string",
      "description": "Organization name for Xcode project",
      "required": true,
      "example": "My Company"
    },
    {
      "name": "bundleIdentifier",
      "type": "string",
      "description": "iOS bundle identifier",
      "required": true,
      "example": "com.mycompany.mysyncapp",
      "validation": "^[a-z][a-z0-9-]*(\\.[a-z][a-z0-9-]*)+$"
    }
  ],
  "generation": {
    "fileTransforms": [
      {
        "pattern": "**/*.swift",
        "processor": "handlebars"
      },
      {
        "pattern": "**/*.plist",
        "processor": "handlebars"
      },
      {
        "pattern": "**/project.pbxproj",
        "processor": "handlebars"
      }
    ]
  },
  "documentation": {
    "readme": "README.md",
    "gettingStarted": "https://developer.salesforce.com/docs/platform/mobile-sdk/guide/ios-get-started.html"
  },
  "tags": [
    "ios",
    "swift",
    "swiftui",
    "salesforce",
    "mobilesync",
    "offline",
    "widgets",
    "moderate"
  ]
}